{"decision_index":58,"event_refs":[],"id":"ledger-day-58-offered","kind":"support_stage_ledger","partition_id":"obs2-partition","patient_id":"SYN-02","rule":{"id":"fixture-explicit-stage-execution","sha256":"0000000000000000000000000000000000000000000000000000000000000000","version":"2.0.0"},"run_id":"obs2-fixture-run","schema_version":"2.0.0","stage":"offered","synthetic":true,"window_id":"window-f62d0b78c9dffe3be6ab624d3f4bd421"}