{"decision_index":5,"event_refs":[],"id":"ledger-delivered-d5","kind":"support_stage_ledger","partition_id":"obs2-partition","patient_id":"SYN-02","rule":{"id":"fixture-explicit-stage-execution","sha256":"0000000000000000000000000000000000000000000000000000000000000000","version":"2.0.0"},"run_id":"obs2-fixture-run","schema_version":"2.0.0","stage":"delivered","synthetic":true,"window_id":"window-e0be6ce5ae1e209456d774e2098e36db"}