{"decision_index":67,"event_refs":[],"id":"ledger-offered-d67","kind":"support_stage_ledger","partition_id":"obs2-partition","patient_id":"SYN-02","rule":{"id":"fixture-explicit-stage-execution","sha256":"0000000000000000000000000000000000000000000000000000000000000000","version":"2.0.0"},"run_id":"obs2-fixture-run","schema_version":"2.0.0","stage":"offered","synthetic":true,"window_id":"window-b2131263517ceab99ff1d4af3d6249dc"}